{
  "schema_version": 1,
  "schema_id": "palyra.feature-rollout-promotions.v1",
  "schema_sha256": "98fc09a7db5f2249867e6925707273a5ed6e0980dc6732c23de463f7d067f1aa",
  "evidence_profiles": {
    "descriptor_only": {
      "required_test_refs": [
        "cargo test -p palyra-daemon --test current_state_inventory --locked",
        "cargo test -p palyra-daemon --test admin_surface --locked"
      ],
      "sli": {
        "indicator": "registered descriptor inventory coverage",
        "objective": "100 percent of registered descriptors expose owner and lifecycle metadata",
        "window": "each runtime-contract CI run"
      },
      "rollback": {
        "mechanism": "revert promotion metadata while preserving accepted rollout configuration keys",
        "verification": "runtime-contract snapshots pass with the prior compatible maturity projection"
      },
      "compatibility_commitment": "Existing configuration keys and the legacy maturity projection remain accepted through the documented retirement gate.",
      "legacy_removal_condition": "Remove a legacy descriptor only after its configuration key completes one compatibility window and inventory no longer advertises it."
    },
    "runtime_canary": {
      "required_test_refs": [
        "cargo test -p palyra-daemon runtime_preview --locked",
        "cargo test -p palyra-daemon --test current_state_inventory --locked"
      ],
      "sli": {
        "indicator": "canary terminal error and degraded-outcome rate",
        "objective": "no unclassified terminal errors and no regression from the disabled control path",
        "window": "each targeted canary suite and release candidate"
      },
      "rollback": {
        "mechanism": "disable the canonical feature rollout setting",
        "verification": "the disabled control path passes its targeted regression suite and inventory reports inactive activation"
      },
      "compatibility_commitment": "Default-off behavior and existing API response fields remain stable while the canary implementation evolves.",
      "legacy_removal_condition": "Remove the disabled control path only after stable promotion and one supported compatibility window."
    },
    "execution_backend_blocked": {
      "required_test_refs": [
        "cargo test -p palyra-daemon execution_backend_parity --locked",
        "cargo test -p palyra-workerd remote_tool_kind_maps_backend_parity_tools --locked",
        "bash scripts/test/run-critical-attack-scenarios.sh"
      ],
      "sli": {
        "indicator": "backend parity scenario completion",
        "objective": "all policy, attestation, cancellation, cleanup, and unavailable-backend scenarios pass",
        "window": "each execution-backend release qualification run"
      },
      "rollback": {
        "mechanism": "retain the backend in blocked posture and route only to established local execution",
        "verification": "backend diagnostics report blocked and critical attack scenarios remain green"
      },
      "compatibility_commitment": "Blocked backend identifiers remain parseable but cannot become execution targets until qualification completes.",
      "legacy_removal_condition": "Remove a blocked backend identifier only after callers migrate to a supported backend and one compatibility window elapses."
    },
    "tool_repair_contract": {
      "required_test_refs": [
        "cargo test -p palyra-daemon tool_repair --locked",
        "cargo test -p palyra-daemon --test current_state_inventory --locked"
      ],
      "sli": {
        "indicator": "observe-only repair audit integrity",
        "objective": "eligible repair decisions emit bounded redacted durable audit records without changing tool outcomes",
        "window": "each tool-repair regression run"
      },
      "rollback": {
        "mechanism": "revert future rollout-controlled execution changes while retaining established repair behavior and durable audit evidence",
        "verification": "tool-repair regressions pass and diagnostics retain the contract-only posture"
      },
      "compatibility_commitment": "The established repair result and durable observe-only audit envelope remain unchanged while the rollout flag is non-authoritative.",
      "legacy_removal_condition": "Remove the non-authoritative flag only after diagnostics consumers migrate and durable audit replay compatibility is proven."
    },
    "non_authoritative_runtime_contract": {
      "required_test_refs": [
        "cargo test -p palyra-daemon --test current_state_inventory --locked",
        "cargo test -p palyra-daemon --test admin_surface --locked"
      ],
      "sli": {
        "indicator": "non-authoritative rollout contract accuracy",
        "objective": "every accepted but unwired rollout key reports contract-only posture and no effective runtime activation",
        "window": "each runtime-contract CI run"
      },
      "rollback": {
        "mechanism": "revert promotion metadata without claiming that the accepted rollout key changes established runtime behavior",
        "verification": "runtime-contract snapshots preserve the contract-only posture and explicit non-authoritative activation reason"
      },
      "compatibility_commitment": "Existing runtime behavior remains independent of the accepted rollout key until a reviewed activation boundary is wired.",
      "legacy_removal_condition": "Remove the non-authoritative key only after diagnostics consumers migrate or replace it with a tested authoritative activation boundary."
    },
    "provider_canary": {
      "required_test_refs": [
        "cargo test -p palyra-model-providers --locked",
        "cargo test -p palyra-daemon provider_stream --locked",
        "cargo test -p palyra-daemon responses_failed_stream_event --locked"
      ],
      "sli": {
        "indicator": "provider normalization and recovery terminal failure rate",
        "objective": "all failures produce one classified terminal outcome with no raw provider payload exposure",
        "window": "each provider regression suite and release candidate"
      },
      "rollback": {
        "mechanism": "disable the provider rollout and use the established provider path",
        "verification": "provider regressions pass and diagnostics report the rollout inactive"
      },
      "compatibility_commitment": "Provider-facing error envelopes and terminal stream semantics remain backward compatible during canary qualification.",
      "legacy_removal_condition": "Remove the established provider path only after stable promotion and replay fixtures prove compatibility."
    },
    "security_canary": {
      "required_test_refs": [
        "cargo test -p palyra-cli security --locked",
        "bash scripts/check-high-risk-patterns.sh"
      ],
      "sli": {
        "indicator": "security regression and redaction gate result",
        "objective": "zero high-risk pattern violations and zero unredacted diagnostic fields",
        "window": "each security gate run"
      },
      "rollback": {
        "mechanism": "disable the rollout and retain the established fail-closed security boundary",
        "verification": "security tests and the high-risk pattern scan pass"
      },
      "compatibility_commitment": "Security rollouts may only preserve or strengthen existing denials and redaction guarantees.",
      "legacy_removal_condition": "Remove a legacy security path only after equivalent denial and redaction coverage is proven on the replacement."
    },
    "channel_kernel_deprecated": {
      "required_test_refs": [
        "cargo test -p palyra-daemon channel_turn --locked",
        "cargo test -p palyra-daemon --test current_state_inventory --locked"
      ],
      "sli": {
        "indicator": "always-on channel turn completion and error rate",
        "objective": "the always-on runtime preserves classified outcomes while the diagnostic-only flag receives no routing authority",
        "window": "each channel-turn regression run"
      },
      "rollback": {
        "mechanism": "revert the always-on channel runtime change independently of the ignored legacy flag",
        "verification": "channel-turn regressions pass and diagnostics continue to identify the flag as ineffective"
      },
      "compatibility_commitment": "Older configurations may continue to contain the flag while it remains ignored and visibly deprecated.",
      "legacy_removal_condition": "Remove the flag after old clients tolerate its deprecated projection and the always-on runtime retains rollback coverage."
    },
    "verification_canary": {
      "required_test_refs": [
        "cargo test -p palyra-daemon verification_runtime --locked",
        "cargo test -p palyra-daemon --test current_state_inventory --locked"
      ],
      "sli": {
        "indicator": "verification evidence completion and fallback classification rate",
        "objective": "all verification attempts produce redacted classified evidence with no unreported fallback",
        "window": "each verification runtime regression run"
      },
      "rollback": {
        "mechanism": "disable verification_runtime and use the established checkpoint flow",
        "verification": "checkpoint regressions pass and runtime usage reports only the explicit fallback path"
      },
      "compatibility_commitment": "Verification evidence remains additive and existing checkpoint result fields retain their meaning.",
      "legacy_removal_condition": "Remove the established checkpoint path only after direct and fallback usage evidence qualifies stable promotion."
    },
    "compaction_gated": {
      "required_test_refs": [
        "cargo test -p palyra-daemon session_compaction --locked",
        "cargo test -p palyra-daemon gateway::tests::session_compaction_safeguard_rolls_back_writes_when_rollout_enforces_failure --locked -- --exact",